{
  "type" : "CRAC",
  "version" : "2.1",
  "info" : "Generated by OpenRAO http://farao-community.github.io",
  "id" : "curative_7",
  "name" : "curative_7",
  "instants" : [ {
    "id" : "preventive",
    "kind" : "PREVENTIVE"
  }, {
    "id" : "outage",
    "kind" : "OUTAGE"
  }, {
    "id" : "auto",
    "kind" : "AUTO"
  }, {
    "id" : "curative",
    "kind" : "CURATIVE"
  } ],
  "ra-usage-limits-per-instant" : [ {
    "instant": "curative",
    "max-ra" : 1,
    "max-tso" : 2147483647,
    "max-topo-per-tso" : { },
    "max-pst-per-tso" : {
      "be" : 0,
      "fr" : 0
    },
    "max-ra-per-tso" : { }
  } ],
  "networkElementsNamePerId" : { },
  "contingencies" : [ {
    "id" : "co1_fr2_fr3_1",
    "networkElementsIds" : [ "FFR2AA1  FFR3AA1  1" ]
  } ],
  "flowCnecs" : [ {
    "id" : "BBE1AA1  FFR5AA1  1 - preventive",
    "name" : "be1_fr5_n",
    "networkElementId" : "BBE1AA1  FFR5AA1  1",
    "operator" : null,
    "instant" : "preventive",
    "optimized" : true,
    "monitored" : false,
    "reliabilityMargin" : 0.0,
    "iMax" : [ 2000.0 ],
    "nominalV" : [ 400.0 ],
    "thresholds" : [ {
      "unit" : "ampere",
      "min" : -1500.0,
      "max" : 1500.0,
      "side" : "right"
    } ]
  }, {
    "id" : "FFR3AA1  FFR5AA1  1 - co1_fr2_fr3_1 - curative",
    "name" : "fr3_fr5_co1",
    "networkElementId" : "FFR3AA1  FFR5AA1  1",
    "operator" : null,
    "instant" : "curative",
    "contingencyId" : "co1_fr2_fr3_1",
    "optimized" : true,
    "monitored" : false,
    "reliabilityMargin" : 0.0,
    "iMax" : [ 2000.0 ],
    "nominalV" : [ 400.0 ],
    "thresholds" : [ {
      "unit" : "ampere",
      "min" : -1000.0,
      "max" : 1000.0,
      "side" : "right"
    } ]
  } ],
  "angleCnecs" : [ ],
  "voltageCnecs" : [ ],
  "pstRangeActions" : [ {
    "id" : "pst_be",
    "name" : "pst_be",
    "operator" : "be",
    "onInstantUsageRules" : [ {
      "instant" : "curative",
      "usageMethod" : "available"
    } ],
    "networkElementId" : "BBE2AA1  BBE3AA1  1",
    "initialTap" : 0,
    "tapToAngleConversionMap" : {
      "-1" : -0.3896097993971608,
      "0" : 0.0,
      "-2" : -0.7792105912934298,
      "1" : 0.3896097993971608,
      "-3" : -1.1687933694373345,
      "2" : 0.7792105912934298,
      "-4" : -1.5583491300758083,
      "3" : 1.1687933694373345,
      "-5" : -1.9478688732023104,
      "4" : 1.5583491300758083,
      "-6" : -2.337343603803646,
      "5" : 1.9478688732023104,
      "-7" : -2.7267643331050597,
      "6" : 2.337343603803646,
      "-8" : -3.1161220798131644,
      "7" : 2.7267643331050597,
      "-9" : -3.505407871356285,
      "8" : 3.1161220798131644,
      "-10" : -3.894612745121778,
      "9" : 3.505407871356285,
      "-11" : -4.283727749689918,
      "10" : 3.894612745121778,
      "-12" : -4.672743946063913,
      "11" : 4.283727749689918,
      "-13" : -5.061652408895631,
      "12" : 4.672743946063913,
      "-14" : -5.4504442277066305,
      "13" : 5.061652408895631,
      "-15" : -5.839110508104064,
      "14" : 5.4504442277066305,
      "-16" : -6.2276423729910535,
      "15" : 5.839110508104064,
      "16" : 6.2276423729910535
    },
    "ranges" : [ {
      "min" : -16,
      "max" : 16,
      "rangeType" : "absolute"
    } ]
  }, {
    "id" : "pst_fr",
    "name" : "pst_fr",
    "operator" : "fr",
    "onInstantUsageRules" : [ {
      "instant" : "curative",
      "usageMethod" : "available"
    } ],
    "networkElementId" : "FFR2AA1  FFR4AA1  1",
    "initialTap" : 5,
    "tapToAngleConversionMap" : {
      "-1" : -0.3896097993971608,
      "0" : 0.0,
      "-2" : -0.7792105912934298,
      "1" : 0.3896097993971608,
      "-3" : -1.1687933694373345,
      "2" : 0.7792105912934298,
      "-4" : -1.5583491300758083,
      "3" : 1.1687933694373345,
      "-5" : -1.9478688732023104,
      "4" : 1.5583491300758083,
      "-6" : -2.337343603803646,
      "5" : 1.9478688732023104,
      "-7" : -2.7267643331050597,
      "6" : 2.337343603803646,
      "-8" : -3.1161220798131644,
      "7" : 2.7267643331050597,
      "-9" : -3.505407871356285,
      "8" : 3.1161220798131644,
      "-10" : -3.894612745121778,
      "9" : 3.505407871356285,
      "-11" : -4.283727749689918,
      "10" : 3.894612745121778,
      "-12" : -4.672743946063913,
      "11" : 4.283727749689918,
      "-13" : -5.061652408895631,
      "12" : 4.672743946063913,
      "-14" : -5.4504442277066305,
      "13" : 5.061652408895631,
      "-15" : -5.839110508104064,
      "14" : 5.4504442277066305,
      "-16" : -6.2276423729910535,
      "15" : 5.839110508104064,
      "16" : 6.2276423729910535
    },
    "ranges" : [ {
      "min" : -10,
      "max" : 10,
      "rangeType" : "relativeToPreviousInstant"
    } ]
  } ],
  "hvdcRangeActions" : [ ],
  "injectionRangeActions" : [ ],
  "counterTradeRangeActions" : [ ],
  "networkActions" : [ {
    "id" : "close_de3_de4",
    "name" : "close_de3_de4",
    "operator" : "de",
    "onInstantUsageRules" : [ {
      "instant" : "curative",
      "usageMethod" : "available"
    } ],
    "topologicalActions" : [ {
      "networkElementId" : "DDE3AA1  DDE4AA1  1",
      "actionType" : "close"
    } ]
  }, {
    "id" : "close_fr1_fr5",
    "name" : "close_fr1_fr5",
    "operator" : "fr",
    "onInstantUsageRules" : [ {
      "instant" : "curative",
      "usageMethod" : "available"
    } ],
    "topologicalActions" : [ {
      "networkElementId" : "FFR1AA1  FFR5AA1  1",
      "actionType" : "close"
    } ]
  }, {
    "id" : "open_be1_be4",
    "name" : "open_be1_be4",
    "operator" : "be",
    "onInstantUsageRules" : [ {
      "instant" : "curative",
      "usageMethod" : "available"
    } ],
    "topologicalActions" : [ {
      "networkElementId" : "BBE1AA1  BBE4AA1  1",
      "actionType" : "open"
    } ]
  }, {
    "id" : "open_fr1_fr2",
    "name" : "open_fr1_fr2",
    "operator" : "fr",
    "onInstantUsageRules" : [ {
      "instant" : "curative",
      "usageMethod" : "available"
    } ],
    "topologicalActions" : [ {
      "networkElementId" : "FFR1AA1  FFR2AA1  1",
      "actionType" : "open"
    } ]
  }, {
    "id" : "open_fr1_fr3",
    "name" : "open_fr1_fr3",
    "operator" : "fr",
    "onInstantUsageRules" : [ {
      "instant" : "curative",
      "usageMethod" : "available"
    } ],
    "topologicalActions" : [ {
      "networkElementId" : "FFR1AA1  FFR3AA1  1",
      "actionType" : "open"
    } ]
  } ]
}