{
  "type": "CRAC",
  "version": "2.1",
  "info": "Generated by FARAO http://farao-community.github.io",
  "id": "CRAC_91_12_2",
  "name": "CRAC_91_12_2",
  "instants": [
    {
      "id" : "preventive",
      "kind" : "PREVENTIVE"
    },
    {
      "id" : "outage",
      "kind" : "OUTAGE"
    },
    {
      "id" : "curative1",
      "kind" : "CURATIVE"
    },
    {
      "id" : "curative2",
      "kind" : "CURATIVE"
    },
    {
      "id" : "curative3",
      "kind" : "CURATIVE"
    }
  ],
  "ra-usage-limits-per-instant" :  [ {
    "instant": "curative1",
    "max-ra": 0
  }, {
    "instant": "curative2",
    "max-ra": 1
  }, {
    "instant": "curative3",
    "max-ra": 1
  } ],
  "networkElementsNamePerId": {},
  "contingencies": [
    {
      "id": "Contingency DE2 DE3 1",
      "networkElementsIds": [
        "DDE2AA1  DDE3AA1  1"
      ]
    }
  ],
  "flowCnecs": [
    {
      "id": "NNL2AA1  BBE3AA1  1 - preventive",
      "name": "NNL2AA1  BBE3AA1  1 - preventive",
      "networkElementId": "NNL2AA1  BBE3AA1  1",
      "operator": null,
      "instant": "preventive",
      "optimized": true,
      "monitored": false,
      "reliabilityMargin": 0.0,
      "iMax": [
        5000.0
      ],
      "nominalV": [
        400.0
      ],
      "thresholds": [
        {
          "unit": "megawatt",
          "min": -800.0,
          "max": 800.0,
          "side" : "left"
        }
      ]
    },
    {
      "id": "NNL2AA1  BBE3AA1  1 - Contingency DE2 DE3 1 - outage",
      "name": "NNL2AA1  BBE3AA1  1 - Contingency DE2 DE3 1 - outage",
      "networkElementId": "NNL2AA1  BBE3AA1  1",
      "contingencyId": "Contingency DE2 DE3 1",
      "operator": null,
      "instant": "outage",
      "optimized": true,
      "monitored": false,
      "reliabilityMargin": 0.0,
      "iMax": [
        50.0
      ],
      "nominalV": [
        400.0
      ],
      "thresholds": [
        {
          "unit": "megawatt",
          "min": -1000.0,
          "max": 1000.0,
          "side" : "left"
        }
      ]
    },
    {
      "id": "NNL2AA1  BBE3AA1  1 - Contingency DE2 DE3 1 - curative1",
      "name": "NNL2AA1  BBE3AA1  1 - Contingency DE2 DE3 1 - curative1",
      "networkElementId": "NNL2AA1  BBE3AA1  1",
      "contingencyId": "Contingency DE2 DE3 1",
      "operator": null,
      "instant": "curative1",
      "optimized": true,
      "monitored": false,
      "reliabilityMargin": 0.0,
      "iMax": [
        50.0
      ],
      "nominalV": [
        400.0
      ],
      "thresholds": [
        {
          "unit": "megawatt",
          "min": -500.0,
          "max": 500.0,
          "side" : "left"
        }
      ]
    },
    {
      "id": "NNL2AA1  BBE3AA1  1 - Contingency DE2 DE3 1 - curative2",
      "name": "NNL2AA1  BBE3AA1  1 - Contingency DE2 DE3 1 - curative2",
      "networkElementId": "NNL2AA1  BBE3AA1  1",
      "contingencyId": "Contingency DE2 DE3 1",
      "operator": null,
      "instant": "curative2",
      "optimized": true,
      "monitored": false,
      "reliabilityMargin": 0.0,
      "iMax": [
        50.0
      ],
      "nominalV": [
        400.0
      ],
      "thresholds": [
        {
          "unit": "megawatt",
          "min": -300.0,
          "max": 300.0,
          "side" : "left"
        }
      ]
    },
    {
      "id": "NNL2AA1  BBE3AA1  1 - Contingency DE2 DE3 1 - curative3",
      "name": "NNL2AA1  BBE3AA1  1 - Contingency DE2 DE3 1 - curative3",
      "networkElementId": "NNL2AA1  BBE3AA1  1",
      "contingencyId": "Contingency DE2 DE3 1",
      "operator": null,
      "instant": "curative3",
      "optimized": true,
      "monitored": false,
      "reliabilityMargin": 0.0,
      "iMax": [
        50.0
      ],
      "nominalV": [
        400.0
      ],
      "thresholds": [
        {
          "unit": "megawatt",
          "min": -250.0,
          "max": 250.0,
          "side" : "left"
        }
      ]
    }
  ],
  "pstRangeActions": [
    {
      "id": "CRA_PST_BE",
      "name": "CRA_PST_BE",
      "operator": "BE",
      "onInstantUsageRules": [
        {
          "instant": "curative2",
          "usageMethod": "available"
        },
        {
          "instant": "curative3",
          "usageMethod": "available"
        }
      ],
      "networkElementId": "BBE2AA1  BBE3AA1  1",
      "initialTap": 0,
      "tapToAngleConversionMap": {
        "-1": -0.3896097993971608,
        "0": 0.0,
        "-2": -0.7792105912934298,
        "1": 0.3896097993971608,
        "-3": -1.1687933694373345,
        "2": 0.7792105912934298,
        "-4": -1.5583491300758083,
        "3": 1.1687933694373345,
        "-5": -1.9478688732023104,
        "4": 1.5583491300758083,
        "-6": -2.337343603803646,
        "5": 1.9478688732023104,
        "-7": -2.7267643331050597,
        "6": 2.337343603803646,
        "-8": -3.1161220798131644,
        "7": 2.7267643331050597,
        "-9": -3.505407871356285,
        "8": 3.1161220798131644,
        "-10": -3.894612745121778,
        "9": 3.505407871356285,
        "-11": -4.283727749689918,
        "10": 3.894612745121778,
        "-12": -4.672743946063913,
        "11": 4.283727749689918,
        "-13": -5.061652408895631,
        "12": 4.672743946063913,
        "-14": -5.4504442277066305,
        "13": 5.061652408895631,
        "-15": -5.839110508104064,
        "14": 5.4504442277066305,
        "-16": -6.2276423729910535,
        "15": 5.839110508104064,
        "16": 6.2276423729910535
      },
      "ranges": [
        {
          "min": -16,
          "max": 16,
          "rangeType": "absolute"
        }
      ]
    }
  ],
  "hvdcRangeActions": [],
  "injectionRangeActions": [],
  "networkActions": [
    {
      "id": "PRA_CLOSE_NL2_BE3_3",
      "name": "PRA_CLOSE_NL2_BE3_3",
      "operator": "BE",
      "onInstantUsageRules": [
        {
          "instant": "preventive",
          "usageMethod": "available"
        }
      ],
      "topologicalActions": [
        {
          "networkElementId": "NNL2AA1  BBE3AA1  3",
          "actionType": "close"
        }
      ]
    },
    {
      "id": "Useless_CRA",
      "name": "Useless_CRA",
      "operator": "BE",
      "onInstantUsageRules": [
        {
          "instant": "curative1",
          "usageMethod": "available"
        },
        {
          "instant": "curative2",
          "usageMethod": "available"
        },
        {
          "instant": "curative3",
          "usageMethod": "available"
        }
      ],
      "topologicalActions": [
        {
          "networkElementId": "NNL2AA1  BBE3AA1  3",
          "actionType": "open"
        }
      ]
    }
  ]
}