{
  "type" : "CRAC",
  "version" : "2.1",
  "info" : "Generated by OpenRAO http://farao-community.github.io",
  "id" : "crac",
  "name" : "crac",
  "instants" : [ {
    "id" : "preventive",
    "kind" : "PREVENTIVE"
  }, {
    "id" : "outage",
    "kind" : "OUTAGE"
  }, {
    "id" : "curative1",
    "kind" : "CURATIVE"
  }, {
    "id" : "curative2",
    "kind" : "CURATIVE"
  }, {
    "id" : "curative3",
    "kind" : "CURATIVE"
  }],
  "ra-usage-limits-per-instant" : [
    {
    "instant" : "curative3",
    "max-ra" : 8,
    "max-tso" : 3,
    "max-topo-per-tso" : {
      "FR" : 4,
      "BE" : 5
    },
    "max-pst-per-tso" : {
      "FR" : 6,
      "BE" : 6
    },
    "max-ra-per-tso" : {
      "FR" : 10,
      "BE" : 8
    },
    "max-elementary-actions-per-tso" : {
      "FR" : 5,
      "BE" : 12
    }
  }, {
    "instant" : "curative2",
    "max-ra" : 5,
    "max-tso" : 3,
    "max-topo-per-tso" : {
      "FR" : 3,
      "BE" : 2
    },
    "max-pst-per-tso" : {
      "FR" : 4,
      "BE" : 5
    },
    "max-ra-per-tso" : {
      "FR" : 6,
      "BE" : 5
    },
    "max-elementary-actions-per-tso" : {
      "FR" : 3,
      "BE" : 10
    }
  }, {
      "instant" : "curative1",
      "max-ra" : 3
    }
  ],
  "networkElementsNamePerId" : { },
  "contingencies" : [ {
    "id" : "contingency",
    "name" : "CO",
    "networkElementsIds" : [ "FFR1AA1  FFR2AA1  1" ]
  } ],
  "flowCnecs" : [ {
    "id" : "network-element - contingency - curative1",
    "name" : "network-element - contingency - curative1",
    "networkElementId" : "FFR2AA1  FFR3AA1  1",
    "operator" : null,
    "instant" : "curative1",
    "contingencyId" : "contingency",
    "optimized" : true,
    "monitored" : false,
    "reliabilityMargin" : 0.0,
    "iMax" : [ NaN ],
    "nominalV" : [ 400.0 ],
    "thresholds" : [ {
      "unit" : "ampere",
      "min" : -800.0,
      "max" : 800.0,
      "side" : "left"
    } ]
  }, {
    "id" : "network-element - contingency - curative2",
    "name" : "network-element - contingency - curative2",
    "networkElementId" : "FFR2AA1  FFR3AA1  1",
    "operator" : null,
    "instant" : "curative2",
    "contingencyId" : "contingency",
    "optimized" : true,
    "monitored" : false,
    "reliabilityMargin" : 0.0,
    "iMax" : [ NaN ],
    "nominalV" : [ 400.0 ],
    "thresholds" : [ {
      "unit" : "ampere",
      "min" : -750.0,
      "max" : 750.0,
      "side" : "left"
    } ]
  } ],
  "angleCnecs" : [ ],
  "voltageCnecs" : [ ],
  "pstRangeActions" : [
    {
      "id": "prev-pst-fr",
      "name": "prev-pst-fr",
      "operator": "FR",
      "initialTap": 0,
      "speed": 1,
      "tapToAngleConversionMap" : {
        "-1" : -0.3896097993971608,
        "0" : 0.0,
        "-2" : -0.7792105912934298,
        "1" : 0.3896097993971608,
        "-3" : -1.1687933694373345,
        "2" : 0.7792105912934298,
        "-4" : -1.5583491300758083,
        "3" : 1.1687933694373345,
        "-5" : -1.9478688732023104,
        "4" : 1.5583491300758083,
        "-6" : -2.337343603803646,
        "5" : 1.9478688732023104,
        "-7" : -2.7267643331050597,
        "6" : 2.337343603803646,
        "-8" : -3.1161220798131644,
        "7" : 2.7267643331050597,
        "-9" : -3.505407871356285,
        "8" : 3.1161220798131644,
        "-10" : -3.894612745121778,
        "9" : 3.505407871356285,
        "-11" : -4.283727749689918,
        "10" : 3.894612745121778,
        "-12" : -4.672743946063913,
        "11" : 4.283727749689918,
        "-13" : -5.061652408895631,
        "12" : 4.672743946063913,
        "-14" : -5.4504442277066305,
        "13" : 5.061652408895631,
        "-15" : -5.839110508104064,
        "14" : 5.4504442277066305,
        "-16" : -6.2276423729910535,
        "15" : 5.839110508104064,
        "16" : 6.2276423729910535
      },
      "onInstantUsageRules": [
        {
          "usageMethod": "available",
          "instant": "preventive"
        }
      ],
      "ranges": [
        {
          "min": -15,
          "max": 15,
          "rangeType": "absolute"
        }
      ],
      "networkElementId": "FFR2AA1  FFR4AA1  1"
    }, {
      "id": "cur1-pst-be",
      "name": "cur1-pst-be",
      "operator": "BE",
      "initialTap": 0,
      "speed": 1,
      "tapToAngleConversionMap" : {
        "-1" : -0.3896097993971608,
        "0" : 0.0,
        "-2" : -0.7792105912934298,
        "1" : 0.3896097993971608,
        "-3" : -1.1687933694373345,
        "2" : 0.7792105912934298,
        "-4" : -1.5583491300758083,
        "3" : 1.1687933694373345,
        "-5" : -1.9478688732023104,
        "4" : 1.5583491300758083,
        "-6" : -2.337343603803646,
        "5" : 1.9478688732023104,
        "-7" : -2.7267643331050597,
        "6" : 2.337343603803646,
        "-8" : -3.1161220798131644,
        "7" : 2.7267643331050597,
        "-9" : -3.505407871356285,
        "8" : 3.1161220798131644,
        "-10" : -3.894612745121778,
        "9" : 3.505407871356285,
        "-11" : -4.283727749689918,
        "10" : 3.894612745121778,
        "-12" : -4.672743946063913,
        "11" : 4.283727749689918,
        "-13" : -5.061652408895631,
        "12" : 4.672743946063913,
        "-14" : -5.4504442277066305,
        "13" : 5.061652408895631,
        "-15" : -5.839110508104064,
        "14" : 5.4504442277066305,
        "-16" : -6.2276423729910535,
        "15" : 5.839110508104064,
        "16" : 6.2276423729910535
      },
      "onInstantUsageRules": [
        {
          "usageMethod": "available",
          "instant": "curative1"
        }
      ],
      "ranges": [
        {
          "min": -15,
          "max": 15,
          "rangeType": "absolute"
        }
      ],
      "networkElementId": "BBE2AA1  BBE3AA1  1"
    }
  ],
  "hvdcRangeActions" : [ ],
  "injectionRangeActions" : [ ],
  "counterTradeRangeActions" : [ ],
  "networkActions" : [ {
    "id" : "prev-open-be-1",
    "name" : "prev-open-be-1",
    "operator" : "BE",
    "onInstantUsageRules" : [ {
      "instant" : "preventive",
      "usageMethod" : "available"
    } ],
    "topologicalActions" : [ {
      "networkElementId" : "BBE1AA1  BBE2AA1  1",
      "actionType" : "open"
    } ]
  }, {
    "id" : "prev-close-be-2",
    "name" : "prev-close-be-2",
    "operator" : "BE",
    "onInstantUsageRules" : [ {
      "instant" : "preventive",
      "usageMethod" : "available"
    } ],
    "topologicalActions" : [ {
      "networkElementId" : "BBE2AA1  BBE3AA1  1",
      "actionType" : "close"
    } ]
  }, {
    "id" : "cur1-open-fr-1",
    "name" : "cur1-open-fr-1",
    "operator" : "FR",
    "onInstantUsageRules" : [ {
      "instant" : "curative1",
      "usageMethod" : "available"
    } ],
    "topologicalActions" : [ {
      "networkElementId" : "FFR1AA1  FFR3AA1  1",
      "actionType" : "open"
    } ]
  }, {
      "id" : "cur2-open-fr-2",
      "name" : "cur2-open-fr-2",
      "operator" : "FR",
      "onInstantUsageRules" : [ {
        "instant" : "curative2",
        "usageMethod" : "available"
      } ],
      "topologicalActions" : [ {
        "networkElementId" : "FFR2AA1  FFR3AA1  1",
        "actionType" : "open"
      } ]
    }]
}