{
  "type" : "CRAC",
  "version" : "2.1",
  "info" : "Generated by OpenRAO http://farao-community.github.io",
  "id" : "20161215_0430_2D4_CRAC_FR",
  "name" : "20161215_0430_2D4_CRAC_FR",
  "instants" : [ {
    "id" : "preventive",
    "kind" : "PREVENTIVE"
  }, {
    "id" : "outage",
    "kind" : "OUTAGE"
  }, {
    "id" : "auto",
    "kind" : "AUTO"
  }, {
    "id" : "curative",
    "kind" : "CURATIVE"
  } ],
  "ra-usage-limits-per-instant" : [ {
    "instant": "curative",
    "max-ra" : 1,
    "max-tso" : 2147483647,
    "max-topo-per-tso" : { },
    "max-pst-per-tso" : { },
    "max-ra-per-tso" : { }
  } ],
  "networkElementsNamePerId" : { },
  "contingencies" : [ {
    "id" : "co1_be1_fr5",
    "networkElementsIds" : [ "BBE1AA11 FFR5AA11 1" ]
  } ],
  "flowCnecs" : [ {
    "id" : "be3_be4_co1 - BBE3AA11->BBE4AA11  - co1_be1_fr5 - auto",
    "name" : "be3_be4_co1",
    "networkElementId" : "BBE3AA11 BBE4AA11 1",
    "operator" : null,
    "instant" : "auto",
    "contingencyId" : "co1_be1_fr5",
    "optimized" : true,
    "monitored" : false,
    "reliabilityMargin" : 0.0,
    "iMax" : [ 2000.0 ],
    "nominalV" : [ 400.0 ],
    "thresholds" : [ {
      "unit" : "megawatt",
      "min" : -50.0,
      "max" : 50.0,
      "side" : "left"
    } ]
  }, {
    "id" : "be4_fr5_co1 - BBE4AA11->FFR5AA11  - co1_be1_fr5 - auto",
    "name" : "be4_fr5_co1",
    "networkElementId" : "BBE4AA11 FFR5AA11 1",
    "operator" : null,
    "instant" : "auto",
    "contingencyId" : "co1_be1_fr5",
    "optimized" : true,
    "monitored" : false,
    "reliabilityMargin" : 0.0,
    "iMax" : [ 2000.0 ],
    "nominalV" : [ 400.0 ],
    "thresholds" : [ {
      "unit" : "ampere",
      "min" : -433.0,
      "max" : 433.0,
      "side" : "left"
    } ]
  }, {
    "id" : "be4_fr5_co1 - BBE4AA11->FFR5AA11  - co1_be1_fr5 - curative",
    "name" : "be4_fr5_co1",
    "networkElementId" : "BBE4AA11 FFR5AA11 1",
    "operator" : null,
    "instant" : "curative",
    "contingencyId" : "co1_be1_fr5",
    "optimized" : true,
    "monitored" : false,
    "reliabilityMargin" : 0.0,
    "iMax" : [ 2000.0 ],
    "nominalV" : [ 400.0 ],
    "thresholds" : [ {
      "unit" : "ampere",
      "min" : -433.0,
      "max" : 433.0,
      "side" : "left"
    } ]
  }, {
    "id" : "be4_fr5_co1 - BBE4AA11->FFR5AA11  - co1_be1_fr5 - outage",
    "name" : "be4_fr5_co1",
    "networkElementId" : "BBE4AA11 FFR5AA11 1",
    "operator" : null,
    "instant" : "outage",
    "contingencyId" : "co1_be1_fr5",
    "optimized" : true,
    "monitored" : false,
    "reliabilityMargin" : 0.0,
    "iMax" : [ 2000.0 ],
    "nominalV" : [ 400.0 ],
    "thresholds" : [ {
      "unit" : "ampere",
      "min" : -9999.0,
      "max" : 9999.0,
      "side" : "left"
    } ]
  }, {
    "id" : "be4_fr_5_n - BBE4AA11->FFR5AA11 - preventive",
    "name" : "be4_fr_5_n",
    "networkElementId" : "BBE4AA11 FFR5AA11 1",
    "operator" : null,
    "instant" : "preventive",
    "optimized" : true,
    "monitored" : false,
    "reliabilityMargin" : 0.0,
    "iMax" : [ 2000.0 ],
    "nominalV" : [ 400.0 ],
    "thresholds" : [ {
      "unit" : "ampere",
      "max" : 9999.0,
      "side" : "left"
    } ]
  } ],
  "angleCnecs" : [ ],
  "voltageCnecs" : [ ],
  "pstRangeActions" : [ ],
  "hvdcRangeActions" : [ {
    "id" : "ARA_HVDC",
    "name" : "ARA_HVDC",
    "operator" : "FR",
    "onFlowConstraintUsageRules" : [ {
      "instant" : "auto",
      "flowCnecId" : "be4_fr5_co1 - BBE4AA11->FFR5AA11  - co1_be1_fr5 - auto",
      "usageMethod" : "forced"
    } ],
    "initialSetpoint" : 0.0,
    "ranges" : [ {
      "min" : -2000.0,
      "max" : 2000.0
    } ],
    "networkElementId" : "BBE2AA11 FFR3AA11 1",
    "speed" : 1
  }, {
    "id" : "CRA_HVDC",
    "name" : "CRA_HVDC",
    "operator" : "FR",
    "onFlowConstraintUsageRules" : [ {
      "instant" : "curative",
      "flowCnecId" : "be4_fr5_co1 - BBE4AA11->FFR5AA11  - co1_be1_fr5 - curative",
      "usageMethod" : "available"
    } ],
    "initialSetpoint" : 0.0,
    "ranges" : [ {
      "min" : -2000.0,
      "max" : 2000.0
    } ],
    "networkElementId" : "BBE2AA11 FFR3AA11 1"
  } ],
  "injectionRangeActions" : [ ],
  "counterTradeRangeActions" : [ ],
  "networkActions" : [ ]
}