{
  "type" : "CRAC",
  "version" : "2.1",
  "info" : "Generated by OpenRAO http://farao-community.github.io",
  "id" : "crac",
  "name" : "crac",
  "instants" : [ {
    "id" : "preventive",
    "kind" : "PREVENTIVE"
  }, {
    "id" : "outage",
    "kind" : "OUTAGE"
  }, {
    "id" : "curative1",
    "kind" : "CURATIVE"
  }, {
    "id" : "curative2",
    "kind" : "CURATIVE"
  }, {
    "id" : "curative3",
    "kind" : "CURATIVE"
  } ],
  "ra-usage-limits-per-instant" : [ {
    "instant" : "curative3",
    "max-ra" : 2147483647,
    "max-tso" : 3,
    "max-topo-per-tso" : { },
    "max-pst-per-tso" : { },
    "max-ra-per-tso" : { }
  }, {
    "instant" : "curative2",
    "max-ra" : 2147483647,
    "max-tso" : 2,
    "max-topo-per-tso" : { },
    "max-pst-per-tso" : { },
    "max-ra-per-tso" : { }
  }, {
    "instant" : "curative1",
    "max-ra" : 2147483647,
    "max-tso" : 2,
    "max-topo-per-tso" : { },
    "max-pst-per-tso" : { },
    "max-ra-per-tso" : { }
  } ],
  "networkElementsNamePerId" : { },
  "contingencies" : [ {
    "id" : "contingency",
    "name" : "CO",
    "networkElementsIds" : [ "NNL2AA1  BBE3AA1  1" ]
  } ],
  "flowCnecs" : [ {
    "id" : "FR2-DE3 - contingency - curative1",
    "name" : "FR2-DE3 - contingency - curative1",
    "networkElementId" : "FFR2AA1  DDE3AA1  1",
    "operator" : null,
    "instant" : "curative1",
    "contingencyId" : "contingency",
    "optimized" : true,
    "monitored" : false,
    "reliabilityMargin" : 0.0,
    "iMax" : [ NaN ],
    "nominalV" : [ 400.0 ],
    "thresholds" : [ {
      "unit" : "ampere",
      "min" : -800.0,
      "max" : 800.0,
      "side" : "left"
    } ]
  }, {
    "id" : "FR2-DE3 - contingency - curative2",
    "name" : "FR2-DE3 - contingency - curative2",
    "networkElementId" : "FFR2AA1  DDE3AA1  1",
    "operator" : null,
    "instant" : "curative2",
    "contingencyId" : "contingency",
    "optimized" : true,
    "monitored" : false,
    "reliabilityMargin" : 0.0,
    "iMax" : [ NaN ],
    "nominalV" : [ 400.0 ],
    "thresholds" : [ {
      "unit" : "ampere",
      "min" : -400.0,
      "max" : 400.0,
      "side" : "left"
    } ]
  }, {
    "id" : "FR2-DE3 - contingency - curative3",
    "name" : "FR2-DE3 - contingency - curative3",
    "networkElementId" : "FFR2AA1  DDE3AA1  1",
    "operator" : null,
    "instant" : "curative3",
    "contingencyId" : "contingency",
    "optimized" : true,
    "monitored" : false,
    "reliabilityMargin" : 0.0,
    "iMax" : [ NaN ],
    "nominalV" : [ 400.0 ],
    "thresholds" : [ {
      "unit" : "ampere",
      "min" : -400.0,
      "max" : 400.0,
      "side" : "left"
    } ]
  }, {
    "id" : "FR2-DE3 - contingency - outage",
    "name" : "FR2-DE3 - contingency - outage",
    "networkElementId" : "FFR2AA1  DDE3AA1  1",
    "operator" : null,
    "instant" : "outage",
    "contingencyId" : "contingency",
    "optimized" : true,
    "monitored" : false,
    "reliabilityMargin" : 0.0,
    "iMax" : [ NaN ],
    "nominalV" : [ 400.0 ],
    "thresholds" : [ {
      "unit" : "ampere",
      "min" : -1000.0,
      "max" : 1000.0,
      "side" : "left"
    } ]
  }, {
    "id" : "FR2-DE3 - preventive",
    "name" : "FR2-DE3 - preventive",
    "networkElementId" : "FFR2AA1  DDE3AA1  1",
    "operator" : null,
    "instant" : "preventive",
    "optimized" : true,
    "monitored" : false,
    "reliabilityMargin" : 0.0,
    "iMax" : [ NaN ],
    "nominalV" : [ 400.0 ],
    "thresholds" : [ {
      "unit" : "ampere",
      "min" : -600.0,
      "max" : 600.0,
      "side" : "left"
    } ]
  } ],
  "angleCnecs" : [ ],
  "voltageCnecs" : [ ],
  "pstRangeActions" : [ ],
  "hvdcRangeActions" : [ ],
  "injectionRangeActions" : [ ],
  "counterTradeRangeActions" : [ ],
  "networkActions" : [ {
    "id" : "close-fr2-de3-2",
    "name" : "close-fr2-de3-2",
    "operator" : "BE",
    "onContingencyStateUsageRules" : [ {
      "instant" : "curative1",
      "contingencyId" : "contingency",
      "usageMethod" : "available"
    }, {
      "instant" : "curative2",
      "contingencyId" : "contingency",
      "usageMethod" : "available"
    }, {
      "instant" : "curative3",
      "contingencyId" : "contingency",
      "usageMethod" : "available"
    } ],
    "topologicalActions" : [ {
      "networkElementId" : "FFR2AA1  DDE3AA1  2",
      "actionType" : "close"
    } ]
  }, {
    "id" : "close-fr2-de3-3",
    "name" : "close-fr2-de3-3",
    "operator" : "DE",
    "onContingencyStateUsageRules" : [ {
      "instant" : "curative1",
      "contingencyId" : "contingency",
      "usageMethod" : "available"
    }, {
      "instant" : "curative2",
      "contingencyId" : "contingency",
      "usageMethod" : "available"
    }, {
      "instant" : "curative3",
      "contingencyId" : "contingency",
      "usageMethod" : "available"
    } ],
    "topologicalActions" : [ {
      "networkElementId" : "FFR2AA1  DDE3AA1  3",
      "actionType" : "close"
    } ]
  }, {
    "id" : "close-fr2-de3-4",
    "name" : "close-fr2-de3-4",
    "operator" : "FR",
    "onContingencyStateUsageRules" : [ {
      "instant" : "curative1",
      "contingencyId" : "contingency",
      "usageMethod" : "available"
    }, {
      "instant" : "curative2",
      "contingencyId" : "contingency",
      "usageMethod" : "available"
    }, {
      "instant" : "curative3",
      "contingencyId" : "contingency",
      "usageMethod" : "available"
    } ],
    "topologicalActions" : [ {
      "networkElementId" : "FFR2AA1  DDE3AA1  4",
      "actionType" : "close"
    } ]
  } ]
}