{
  "type" : "CRAC",
  "version" : "2.1",
  "info" : "Generated by OpenRAO http://farao-community.github.io",
  "id" : "20161215_0430_2D4_CRAC_FR",
  "name" : "20161215_0430_2D4_CRAC_FR",
  "instants" : [ {
    "id" : "preventive",
    "kind" : "PREVENTIVE"
  }, {
    "id" : "outage",
    "kind" : "OUTAGE"
  }, {
    "id" : "auto",
    "kind" : "AUTO"
  }, {
    "id" : "curative",
    "kind" : "CURATIVE"
  } ],
  "ra-usage-limits-per-instant" : [ {
    "instant": "curative",
    "max-ra" : 2,
    "max-tso" : 2147483647,
    "max-topo-per-tso" : { },
    "max-pst-per-tso" : { },
    "max-ra-per-tso" : { }
  } ],
  "networkElementsNamePerId" : { },
  "contingencies" : [ {
    "id" : "co1_be1_fr5",
    "networkElementsIds" : [ "BBE1AA11 FFR5AA11 1" ]
  } ],
  "flowCnecs" : [ {
    "id" : "be4_fr5_co1 - BBE4AA11->FFR5AA11  - co1_be1_fr5 - curative",
    "name" : "be4_fr5_co1",
    "networkElementId" : "BBE4AA11 FFR5AA11 1",
    "operator" : null,
    "instant" : "curative",
    "contingencyId" : "co1_be1_fr5",
    "optimized" : true,
    "monitored" : false,
    "reliabilityMargin" : 0.0,
    "iMax" : [ 2000.0 ],
    "nominalV" : [ 400.0 ],
    "thresholds" : [ {
      "unit" : "ampere",
      "min" : -433.0,
      "max" : 433.0,
      "side" : "left"
    } ]
  }, {
    "id" : "be4_fr5_co1 - BBE4AA11->FFR5AA11  - co1_be1_fr5 - outage",
    "name" : "be4_fr5_co1",
    "networkElementId" : "BBE4AA11 FFR5AA11 1",
    "operator" : null,
    "instant" : "outage",
    "contingencyId" : "co1_be1_fr5",
    "optimized" : true,
    "monitored" : false,
    "reliabilityMargin" : 0.0,
    "iMax" : [ 2000.0 ],
    "nominalV" : [ 400.0 ],
    "thresholds" : [ {
      "unit" : "ampere",
      "min" : -9999.0,
      "max" : 9999.0,
      "side" : "left"
    } ]
  }, {
    "id" : "be4_fr_5_n - BBE4AA11->FFR5AA11 - preventive",
    "name" : "be4_fr_5_n",
    "networkElementId" : "BBE4AA11 FFR5AA11 1",
    "operator" : null,
    "instant" : "preventive",
    "optimized" : true,
    "monitored" : false,
    "reliabilityMargin" : 0.0,
    "iMax" : [ 2000.0 ],
    "nominalV" : [ 400.0 ],
    "thresholds" : [ {
      "unit" : "ampere",
      "max" : 9999.0,
      "side" : "left"
    } ]
  } ],
  "angleCnecs" : [ ],
  "voltageCnecs" : [ ],
  "pstRangeActions" : [ {
    "id" : "PST_CRA_PST_be_BBE2AA11 BBE3AA11 1",
    "name" : "CRA_PST_be",
    "operator" : "FR",
    "onInstantUsageRules" : [ {
      "instant" : "curative",
      "usageMethod" : "available"
    } ],
    "networkElementId" : "BBE2AA11 BBE3AA11 1",
    "initialTap" : 0,
    "tapToAngleConversionMap" : {
      "-1" : -0.38960981369018555,
      "0" : 0.0,
      "-2" : -0.77921062707901,
      "1" : 0.38960981369018555,
      "-3" : -1.1687933206558228,
      "2" : 0.77921062707901,
      "-4" : -1.5583491325378418,
      "3" : 1.1687933206558228,
      "-5" : -1.9478689432144165,
      "4" : 1.5583491325378418,
      "-6" : -2.337343454360962,
      "5" : 1.9478689432144165,
      "-7" : -2.726764440536499,
      "6" : 2.337343454360962,
      "-8" : -3.116122007369995,
      "7" : 2.726764440536499,
      "-9" : -3.5054078102111816,
      "8" : 3.116122007369995,
      "-10" : -3.894613027572632,
      "9" : 3.5054078102111816,
      "-11" : -4.283727645874023,
      "10" : 3.894613027572632,
      "-12" : -4.672743797302246,
      "11" : 4.283727645874023,
      "-13" : -5.061652183532715,
      "12" : 4.672743797302246,
      "-14" : -5.450444221496582,
      "13" : 5.061652183532715,
      "-15" : -5.839110374450684,
      "14" : 5.450444221496582,
      "-16" : -6.22764253616333,
      "15" : 5.839110374450684,
      "16" : 6.22764253616333
    },
    "ranges" : [ {
      "min" : -16,
      "max" : 16,
      "rangeType" : "absolute"
    } ]
  } ],
  "hvdcRangeActions" : [ {
    "id" : "CRA_HVDC",
    "name" : "CRA_HVDC",
    "operator" : "FR",
    "onInstantUsageRules" : [ {
      "instant" : "curative",
      "usageMethod" : "available"
    } ],
    "initialSetpoint" : 0.0,
    "ranges" : [ {
      "min" : -2000.0,
      "max" : 2000.0
    } ],
    "networkElementId" : "BBE2AA11 FFR3AA11 1"
  } ],
  "injectionRangeActions" : [ ],
  "counterTradeRangeActions" : [ ],
  "networkActions" : [ ]
}